{
  "version": "1.0",
  "generated": "2026-06-02",
  "mission": "Phase 2: Integration Layer Design \u2014 Backend\u2194Forge Mapping",
  "description": "Full inventory of all 13 forge prototype files at file/screen/sub-component level. Each entry includes sections, mock data arrays with field-by-field mapping, integration readiness labels, builder workspace features (~50 items), and all tweaks panel features.",
  "files": [
    {
      "id": "fheforge-html",
      "name": "FheForge.html",
      "path": "ui/FheForge.html",
      "type": "html-shell",
      "description": "HTML entry point with boot splash, CDN dependencies (React 18.3.1, ReactDOM, Babel standalone), theme persistence script, and script loading order for all forge files. Routes CSS + JS via script tags with Babel transpilation.",
      "sections": [
        {
          "name": "Head / Metadata",
          "description": "HTML meta tags, title 'FheForge \u2014 encrypted DeFi on Arbitrum Sepolia', viewport config, Google Fonts preconnect (Instrument Serif, Newsreader, Public Sans, JetBrains Mono)",
          "mockData": [],
          "integrationReadiness": "ready-to-wire"
        },
        {
          "name": "Theme Persistence Script",
          "description": "Synchronous script that reads localStorage 'fheforge:theme' or prefers-color-scheme to set data-theme attribute on <html> before paint, preventing flash",
          "mockData": [],
          "integrationReadiness": "ready-to-wire"
        },
        {
          "name": "Boot Splash",
          "description": "Full-viewport boot splash with 'FheForge' wordmark, animated dot, 'booting \u00b7 cofhe-sdk \u00b7 421614' label, auto-removed via MutationObserver when root children mount",
          "mockData": [],
          "integrationReadiness": "ready-to-wire"
        },
        {
          "name": "CDN Dependencies",
          "description": "React 18.3.1 (development), ReactDOM 18.3.1 (development), Babel standalone 7.29.0 \u2014 all loaded via unpkg with SRI integrity hashes",
          "mockData": [],
          "integrationReadiness": "ready-to-wire",
          "backendDependencies": [
            "unpkg-cdn"
          ]
        },
        {
          "name": "Script Loading Order",
          "description": "Loads tweaks-panel.jsx \u2192 components.jsx \u2192 screens (landing, dashboard, lending, builder-workspace, market, governance, connect-modal) \u2192 app.jsx. Order matters: builder-workspace before market.",
          "mockData": [],
          "integrationReadiness": "ready-to-wire"
        }
      ],
      "subComponents": [],
      "integrationReadiness": "ready-to-wire"
    },
    {
      "id": "theme-css",
      "name": "theme.css",
      "path": "ui/theme.css",
      "type": "styles",
      "description": "Complete design token system and CSS framework for FheForge. Two themes (light/warm-paper, dark/terminal). Covers typography, layout, components, animations, responsive breakpoints, reduced motion.",
      "sections": [
        {
          "name": "Design Tokens \u2014 Light Theme",
          "description": "CSS custom properties for light theme: surfaces (paper, paper-2, paper-3), ink colors, signal colors (accent, positive, danger), cipher haze, grain RGBA. Uses OKLCH color space.",
          "mockData": [],
          "integrationReadiness": "ready-to-wire"
        },
        {
          "name": "Design Tokens \u2014 Dark Theme",
          "description": "CSS custom properties for dark theme: near-mirror of light with darker surfaces, lighter ink, adjusted signal colors. Uses OKLCH color space.",
          "mockData": [],
          "integrationReadiness": "ready-to-wire"
        },
        {
          "name": "Typography System",
          "description": "Four font families (serif: Newsreader, display: Instrument Serif, sans: Public Sans, mono: JetBrains Mono). Scale with rem values, display/sectionhead/eyebrow/micro classes.",
          "mockData": [],
          "integrationReadiness": "ready-to-wire"
        },
        {
          "name": "Motion Budget",
          "description": "CSS custom properties for animation: --ease (cubic-bezier), --ease-out, --t-feedback (120ms for hover/micro), --t-state (200ms for state changes), --t-enter (400ms for mount)",
          "mockData": [],
          "integrationReadiness": "ready-to-wire"
        },
        {
          "name": "Layout Components",
          "description": "Section, shell (max-width 1480px), topbar (sticky, backdrop-filter), master-detail frame (320px list + detail), chips, buttons (default, ghost, accent, sm, lg), cards/blocks, KV rows, cipher display, LTV meter/gauge, canvas, modal, tabstrip, permit stage",
          "mockData": [],
          "integrationReadiness": "ready-to-wire"
        },
        {
          "name": "Builder Canvas CSS",
          "description": "Canvas grid background, three SVG edge layers (edges/edges-active/ports), zoom controls, node styling (selected/active/past/cycle/dragging), port circles with hover/active/pending states, drop-active highlight, draw-on animation, edge styles (idle, active, selected, error, warn)",
          "mockData": [],
          "integrationReadiness": "ready-to-wire"
        },
        {
          "name": "Animations & Keyframes",
          "description": "nodeIn, fadeIn, edgeDraw, edgeIdleFlow, edgeErrorFlow, cyclePulse, portPulse, pulseDot, orbitDrift, orbitCounter, modalIn, suggestPulse, issuePinPulse, readyPulse, issueToastIn, toastIn, tickerLoop",
          "mockData": [],
          "integrationReadiness": "ready-to-wire"
        },
        {
          "name": "Responsive Breakpoints",
          "description": "980px (grid collapse), 720px (mobile nav, topbar nav hide), 480px (smaller wordmark). Adaptive resize hardening for builder canvas (1279px). Reduced motion media query.",
          "mockData": [],
          "integrationReadiness": "ready-to-wire"
        },
        {
          "name": "Fullscreen Builder Styles",
          "description": "Position fixed, z-index 70, hides topbar, forces md-frame to full height with closed list, hides list and rail toggle",
          "mockData": [],
          "integrationReadiness": "ready-to-wire"
        }
      ],
      "subComponents": [],
      "integrationReadiness": "ready-to-wire"
    },
    {
      "id": "app-jsx",
      "name": "app.jsx",
      "path": "ui/app.jsx",
      "type": "root-app",
      "description": "React root application component with routing between 5 screens (home/portfolio/lend/strategies/governance), wallet context state, permit countdown timer, theme persistence, and tweaks panel integration. Renders TopBar, active Screen, ConnectModal, MobileNav, TweaksPanel.",
      "sections": [
        {
          "name": "App() \u2014 Main Component",
          "description": "Root component managing theme state (light/dark/system default), route state, wallet context (connected, address, permitUnlocked, permitSeconds, revealing), connect modal visibility. Renders TopBar, screen, ConnectModal, MobileNav, TweaksPanel.",
          "stateVariables": [
            "theme (light|dark)",
            "route (home|portfolio|lend|strategies|governance)",
            "ctx (connected, address, permitUnlocked, permitSeconds, revealing)",
            "showConnect (boolean)"
          ],
          "mockData": [
            {
              "array": "TWEAK_DEFAULTS",
              "fields": {
                "startConnected": "boolean \u2014 simulates wallet connection state",
                "startUnlocked": "boolean \u2014 simulates permit grant state",
                "showGrain": "boolean \u2014 toggles paper grain texture"
              },
              "values": {
                "startConnected": false,
                "startUnlocked": false,
                "showGrain": true
              }
            }
          ],
          "integrationReadiness": "ready-to-wire",
          "backendDependencies": [
            "wagmi-useAccount",
            "wagmi-useConnect",
            "wagmi-useDisconnect",
            "cofhe-usePermit",
            "cofhe-usePermitCountdown"
          ]
        },
        {
          "name": "Theme Toggle Logic",
          "description": "Reads initial theme from localStorage or system preference, persists changes, updates data-theme on <html>",
          "mockData": [],
          "integrationReadiness": "ready-to-wire",
          "backendDependencies": []
        },
        {
          "name": "Permit Countdown Timer",
          "description": "useEffect-based countdown that decrements permitSeconds every second, auto-locks when expired",
          "mockData": [],
          "integrationReadiness": "ready-to-wire",
          "backendDependencies": [
            "cofhe-permit-countdown"
          ]
        },
        {
          "name": "grantPermit() \u2014 Staggered Reveal",
          "description": "Connects wallet if not connected, applies staggered cipher reveal delays (50ms per element sorted by top position), sets permitUnlocked=true with 15-minute countdown",
          "mockData": [],
          "integrationReadiness": "ready-to-wire",
          "backendDependencies": [
            "cofhe-grant-permit"
          ]
        },
        {
          "name": "Route System",
          "description": "Simple if/else route switch rendering Landing, Dashboard, Lending, Market, Governance components based on route state",
          "mockData": [],
          "integrationReadiness": "ready-to-wire",
          "backendDependencies": []
        },
        {
          "name": "Global Error Capture",
          "description": "window error event listener that renders error details to root if app fails to mount",
          "mockData": [],
          "integrationReadiness": "ready-to-wire"
        },
        {
          "name": "Webfont FOUT Fix",
          "description": "Relayout on document.fonts.ready to prevent FOIT/FOUT flash",
          "mockData": [],